{
  "schema_version": 1,
  "timing_contract": "disjoint_live_state_v1",
  "sketch_evidence": {
    "schema_version": 1,
    "benchmark_version": "sketch-bench@87f619e843fd2e4da784160d4e205a0d0d55f032; adapter-v2-disjoint",
    "model_version": "empirical-update-cpu-v1",
    "records": [
      {
        "id": "cms-uniform-seed42-w272-d5",
        "algorithm": "Cms",
        "params": {
          "Cms": {
            "width": 272,
            "depth": 5
          }
        },
        "distribution": {
          "id": "uniform-n20000-c1000-seed42",
          "family": "uniform",
          "sample_count": 20000,
          "distinct_count": 1000,
          "parameters": {
            "kind": "uniform",
            "lower_bound": 0.0,
            "upper_bound": 1000.0,
            "seed": 42
          }
        },
        "environment": {
          "cpu": "Intel(R) Xeon(R) Gold 6142 CPU @ 2.60GHz",
          "os": "Linux-5.15.0-177-generic-x86_64-with-glibc2.35",
          "runtime": "rustc 1.97.1 (8bab26f4f 2026-07-14); release; target-cpu=native; jemalloc; POLARS_MAX_THREADS=1",
          "implementation_version": "asap_sketchlib 0.2.2",
          "implementation": "asap_sketchlib RegularPath Vector2D",
          "id": "c9590114bad98348"
        },
        "measured_at_unix_seconds": 1788886308,
        "valid_until_unix_seconds": 1791478308,
        "provenance": {
          "command": "/mydata/sketch-bench-empirical-322/target/release/approxbench sketchbench --variant cms-regularpath-vector2d --library lib --config 'rows=5 cols=272' --dataset uniform --size 20000 --cardinality 1000 --dtype i64 --seed 42 --runs 5 --warmup-runs 2 --operations insert,query,merge --metrics throughput,cpu,memory",
          "dataset": "deterministic synthetic i64 frequency stream, seed 42",
          "source_revision": "87f619e843fd2e4da784160d4e205a0d0d55f032",
          "repetitions": 5
        },
        "metrics": {
          "build_cpu_ns": {
            "value": 505.475,
            "stddev": 2.9324591056398384,
            "samples": 5,
            "method": "CLOCK_PROCESS_CPUTIME_ID around empty sketch constructors in batched live objects; holder allocation and all destruction excluded; jemalloc; five runs after two warmups"
          },
          "update_cpu_ns": {
            "value": 39.18329,
            "stddev": 1.2404534228458564,
            "samples": 5,
            "method": "CLOCK_PROCESS_CPUTIME_ID; live state with constructor/destructor excluded; five runs after two warmups; update per input item; read per all-distinct-key lookup across ten repeated fixed-snapshot probe passes; merge per binary merge; fixed rotated sorted key order"
          },
          "merge_cpu_ns": {
            "value": 1540.0,
            "stddev": 49.21381919745713,
            "samples": 5,
            "method": "CLOCK_PROCESS_CPUTIME_ID; live state with constructor/destructor excluded; five runs after two warmups; update per input item; read per all-distinct-key lookup across ten repeated fixed-snapshot probe passes; merge per binary merge; fixed rotated sorted key order"
          },
          "read_cpu_ns": {
            "value": 41.56236,
            "stddev": 1.2531359914231197,
            "samples": 5,
            "method": "CLOCK_PROCESS_CPUTIME_ID; live state with constructor/destructor excluded; five runs after two warmups; update per input item; read per all-distinct-key lookup across ten repeated fixed-snapshot probe passes; merge per binary merge; fixed rotated sorted key order"
          },
          "retained_bytes": {
            "value": 5440.0,
            "stddev": 0.0,
            "samples": 5,
            "method": "requested allocation bytes using counting System allocator; construction + insertion; sketch alive; dataset excluded; not allocator-resident pages"
          },
          "peak_bytes": {
            "value": 5440.0,
            "stddev": 0.0,
            "samples": 5,
            "method": "requested allocation bytes using counting System allocator; construction + insertion; sketch alive; dataset excluded; not allocator-resident pages"
          },
          "serialized_bytes": {
            "value": 1669,
            "stddev": null,
            "samples": 1,
            "method": "actual serialize_to_bytes MsgPack length; estimate-equivalent roundtrip verified for every input key"
          },
          "disk_bytes": {
            "value": 4096,
            "stddev": null,
            "samples": 1,
            "method": "actual flushed single MsgPack snapshot file allocated blocks*512 on local temporary filesystem; directory/inode overhead excluded; file removed after measurement; not runtime persistence demand"
          }
        },
        "error": {
          "metric": "mean_absolute_relative_frequency_error_all_distinct_keys",
          "mean": 1.6347221960194194,
          "max": null,
          "trials": 1,
          "ground_truth_method": "exact offline HashMap counts; every distinct key probed",
          "query": {
            "kind": "point_frequency",
            "value_type": "i64",
            "accuracy_stddev": null,
            "full_accuracy": {
              "aae_all": 31.035,
              "aae_top1": 25.0,
              "aae_top10": 25.9,
              "aae_top100": 30.2,
              "aae_top1000": 31.035,
              "accuracy_runs": 1,
              "are_all": 1.6347221960194194,
              "are_top1": 0.6097560975609756,
              "are_top10": 0.7804431144999306,
              "are_top100": 1.079453856854533,
              "are_top1000": 1.6347221960194205,
              "l1_err": 31035.0,
              "l2_err": 1159.3657748959126,
              "probes": 1000.0,
              "probes_all": 1000.0,
              "probes_top1": 1.0,
              "probes_top10": 10.0,
              "probes_top100": 100.0,
              "probes_top1000": 1000.0,
              "relative_error_mean": 1.6347221960194194,
              "relative_error_p99": 4.733333333333333
            }
          }
        }
      },
      {
        "id": "countsketch-uniform-seed42-w30000-d83",
        "algorithm": "CountSketch",
        "params": {
          "CountSketch": {
            "width": 30000,
            "depth": 83
          }
        },
        "distribution": {
          "id": "uniform-n20000-c1000-seed42",
          "family": "uniform",
          "sample_count": 20000,
          "distinct_count": 1000,
          "parameters": {
            "kind": "uniform",
            "lower_bound": 0.0,
            "upper_bound": 1000.0,
            "seed": 42
          }
        },
        "environment": {
          "cpu": "Intel(R) Xeon(R) Gold 6142 CPU @ 2.60GHz",
          "os": "Linux-5.15.0-177-generic-x86_64-with-glibc2.35",
          "runtime": "rustc 1.97.1 (8bab26f4f 2026-07-14); release; target-cpu=native; jemalloc; POLARS_MAX_THREADS=1",
          "implementation_version": "asap_sketchlib 0.2.2",
          "implementation": "asap_sketchlib RegularPath Vector2D",
          "id": "c9590114bad98348"
        },
        "measured_at_unix_seconds": 1788886328,
        "valid_until_unix_seconds": 1791478328,
        "provenance": {
          "command": "/mydata/sketch-bench-empirical-322/target/release/approxbench sketchbench --variant countsketch-regularpath-vector2d --library lib --config 'rows=83 cols=30000' --dataset uniform --size 20000 --cardinality 1000 --dtype i64 --seed 42 --runs 5 --warmup-runs 2 --operations insert,query,merge --metrics throughput,cpu,memory",
          "dataset": "deterministic synthetic i64 frequency stream, seed 42",
          "source_revision": "87f619e843fd2e4da784160d4e205a0d0d55f032",
          "repetitions": 5
        },
        "metrics": {
          "build_cpu_ns": {
            "value": 5313752.5,
            "stddev": 285040.9840468121,
            "samples": 5,
            "method": "CLOCK_PROCESS_CPUTIME_ID around empty sketch constructors in batched live objects; holder allocation and all destruction excluded; jemalloc; five runs after two warmups"
          },
          "update_cpu_ns": {
            "value": 958.89495,
            "stddev": 0.37400001336898875,
            "samples": 5,
            "method": "CLOCK_PROCESS_CPUTIME_ID; live state with constructor/destructor excluded; five runs after two warmups; update per input item; read per all-distinct-key lookup across ten repeated fixed-snapshot probe passes; merge per binary merge; fixed rotated sorted key order"
          },
          "merge_cpu_ns": {
            "value": 900674.8,
            "stddev": 6828.900035876935,
            "samples": 5,
            "method": "CLOCK_PROCESS_CPUTIME_ID; live state with constructor/destructor excluded; five runs after two warmups; update per input item; read per all-distinct-key lookup across ten repeated fixed-snapshot probe passes; merge per binary merge; fixed rotated sorted key order"
          },
          "read_cpu_ns": {
            "value": 1381.6785599999998,
            "stddev": 1.1267877186941877,
            "samples": 5,
            "method": "CLOCK_PROCESS_CPUTIME_ID; live state with constructor/destructor excluded; five runs after two warmups; update per input item; read per all-distinct-key lookup across ten repeated fixed-snapshot probe passes; merge per binary merge; fixed rotated sorted key order"
          },
          "retained_bytes": {
            "value": 9960000.0,
            "stddev": 0.0,
            "samples": 5,
            "method": "requested allocation bytes using counting System allocator; construction + insertion; sketch alive; dataset excluded; not allocator-resident pages"
          },
          "peak_bytes": {
            "value": 9960000.0,
            "stddev": 0.0,
            "samples": 5,
            "method": "requested allocation bytes using counting System allocator; construction + insertion; sketch alive; dataset excluded; not allocator-resident pages"
          },
          "serialized_bytes": {